Id,Title,Labels,Iteration,Iteration Start,Iteration End,Type,Estimate,Current State,Created at,Accepted at,Deadline,Requested By,Description,URL,Owned By,Task,Task Status,Task,Task Status,Task,Task Status,Task,Task Status
134242555,pay,important feature,4,"Dec 19, 2016","Jan 1, 2017",feature,,unstarted,"Nov 13, 2016",,,Yu Song Liew,,https://www.pivotaltracker.com/story/show/134242555,,make a combo box for select type of card,not completed,require enter card number and the CVC number,not completed,verify the card number and CVC number,not completed,display message of successful payment,not completed
134242493,Add order food,add order,4,"Dec 19, 2016","Jan 1, 2017",feature,,unstarted,"Nov 13, 2016",,,Yu Song Liew,add order feature,https://www.pivotaltracker.com/story/show/134242493,,select which type of food from combo box,not completed,display the food menu,not completed,allow to choose multiple food and edit,not completed,make a confirmation when submit it,not completed
134242433,add staff,"add, maintain customer",4,"Dec 19, 2016","Jan 1, 2017",feature,,unstarted,"Nov 13, 2016",,,Yu Song Liew,,https://www.pivotaltracker.com/story/show/134242433,,,,,,,,,
133822119,update patient record,,,,,feature,,unscheduled,"Nov 6, 2016",,,Yu Song Liew,,https://www.pivotaltracker.com/story/show/133822119,,check update successful,not completed,check update correctly,not completed,,,,
133821995,add patient record,patient,,,,feature,2,unscheduled,"Nov 6, 2016",,,Yu Song Liew,any patient with ic number,https://www.pivotaltracker.com/story/show/133821995,,check for validity of the ic number,not completed,display error message if wrong ic,not completed,,,,
